A1: Community Affordability
A2: Close Window

A1: Towns Ranked by Share of Owner-Occupied Housing Units <!-- /* Font Definitions */ @font-face {font-family:Helvetica; panose-1:2 11 6 4 2 2 2 2 2 4; mso-font-charset:0; mso-generic-font-family:swiss; mso-font-format:other; mso-font-pitch:variable; mso-font-signature:3 0 0 0 1 0;} @font-face {font-family:Courier; panose-1:2 7 4 9 2 2 5 2 4 4; mso-font-charset:0; mso-generic-font-family:modern; mso-font-format:other; mso-font-pitch:fixed; mso-font-signature:3 0 0 0 1 0;} @font-face {font-family:"Tms Rmn"; panose-1:2 2 6 3 4 5 5 2 3 4; mso-font-charset:0; mso-generic-font-family:roman; mso-font-format:other; mso-font-pitch:variable; mso-font-signature:3 0 0 0 1 0;} @font-face {font-family:Helv; panose-1:2 11 6 4 2 2 2 3 2 4; mso-font-charset:0; mso-generic-font-family:swiss; mso-font-format:other; mso-font-pitch:variable; mso-font-signature:3 0 0 0 1 0;} @font-face {font-family:"New York"; panose-1:2 4 5 3 6 5 6 2 3 4; mso-font-charset:0; mso-generic-font-family:roman; mso-font-format:other; mso-font-pitch:variable; mso-font-signature:3 0 0 0 1 0;} @font-face {font-family:System; panose-1:0 0 0 0 0 0 0 0 0 0; mso-font-charset:0; mso-generic-font-family:swiss; mso-font-format:other; mso-font-pitch:variable; mso-font-signature:3 0 0 0 1 0;} @font-face {font-family:Wingdings; panose-1:5 0 0 0 0 0 0 0 0 0; mso-font-charset:2; mso-generic-font-family:auto; mso-font-pitch:variable; mso-font-signature:0 268435456 0 0 -2147483648 0;} @font-face {font-family:"MS Mincho"; panose-1:2 2 6 9 4 2 5 8 3 4; mso-font-alt:"\FF2D\FF33 \660E\671D"; mso-font-charset:128; mso-generic-font-family:roman; mso-font-format:other; mso-font-pitch:fixed; mso-font-signature:1 134676480 16 0 131072 0;} @font-face {font-family:Batang; panose-1:2 3 6 0 0 1 1 1 1 1; mso-font-alt:\BC14\D0D5; mso-font-charset:129; mso-generic-font-family:auto; mso-font-format:other; mso-font-pitch:fixed; mso-font-signature:1 151388160 16 0 524288 0;} @font-face {font-family:SimSun; panose-1:2 1 6 0 3 1 1 1 1 1; mso-font-alt:\5B8B\4F53; mso-font-charset:134; mso-generic-font-family:auto; mso-font-format:other; mso-font-pitch:variable; mso-font-signature:1 135135232 16 0 262144 0;} @font-face {font-family:PMingLiU; panose-1:2 1 6 1 0 1 1 1 1 1; mso-font-alt:\65B0\7D30\660E\9AD4; mso-font-charset:136; mso-generic-font-family:auto; mso-font-format:other; mso-font-pitch:variable; mso-font-signature:1 134742016 16 0 1048576 0;} @font-face {font-family:"MS Gothic"; panose-1:2 11 6 9 7 2 5 8 2 4; mso-font-alt:"\FF2D\FF33 \30B4\30B7\30C3\30AF"; mso-font-charset:128; mso-generic-font-family:modern; mso-font-format:other; mso-font-pitch:fixed; mso-font-signature:1 134676480 16 0 131072 0;} @font-face {font-family:Dotum; panose-1:2 11 6 0 0 1 1 1 1 1; mso-font-alt:\B3CB\C6C0; mso-font-charset:129; mso-generic-font-family:modern; mso-font-format:other; mso-font-pitch:fixed; mso-font-signature:1 151388160 16 0 524288 0;} @font-face {font-family:SimHei; panose-1:2 1 6 0 3 1 1 1 1 1; mso-font-alt:\9ED1\4F53; mso-font-charset:134; mso-generic-font-family:modern; mso-font-format:other; mso-font-pitch:fixed; mso-font-signature:1 135135232 16 0 262144 0;} @font-face {font-family:MingLiU; panose-1:2 1 6 9 0 1 1 1 1 1; mso-font-alt:\7D30\660E\9AD4; mso-font-charset:136; mso-generic-font-family:modern; mso-font-format:other; mso-font-pitch:fixed; mso-font-signature:1 134742016 16 0 1048576 0;} @font-face {font-family:Mincho; panose-1:2 2 6 9 4 3 5 8 3 5; mso-font-alt:\660E\671D; mso-font-charset:128; mso-generic-font-family:roman; mso-font-format:other; mso-font-pitch:fixed; mso-font-signature:1 134676480 16 0 131072 0;} @font-face {font-family:Gulim; panose-1:2 11 6 0 0 1 1 1 1 1; mso-font-alt:\AD74\B9BC; mso-font-charset:129; mso-generic-font-family:roman; mso-font-format:other; mso-font-pitch:fixed; mso-font-signature:1 151388160 16 0 524288 0;} @font-face {font-family:Century; panose-1:2 4 6 3 5 7 5 2 3 3; mso-font-charset:0; mso-generic-font-family:roman; mso-font-format:other; mso-font-pitch:variable; mso-font-signature:3 0 0 0 1 0;} @font-face {font-family:"Angsana New"; panose-1:2 2 6 3 5 4 5 2 3 4; mso-font-charset:222; mso-generic-font-family:roman; mso-font-format:other; mso-font-pitch:variable; mso-font-signature:16777217 0 0 0 65536 0;} @font-face {font-family:"Cordia New"; panose-1:2 11 3 4 2 2 2 2 2 4; mso-font-charset:222; mso-generic-font-family:roman; mso-font-format:other; mso-font-pitch:variable; mso-font-signature:16777217 0 0 0 65536 0;} @font-face {font-family:Mangal; panose-1:0 0 4 0 0 0 0 0 0 0; mso-font-charset:0; mso-generic-font-family:auto; mso-font-pitch:variable; mso-font-signature:32771 0 0 0 1 0;} @font-face {font-family:Latha; panose-1:2 0 4 0 0 0 0 0 0 0; mso-font-charset:0; mso-generic-font-family:auto; mso-font-pitch:variable; mso-font-signature:1048579 0 0 0 1 0;} @font-face {font-family:Sylfaen; panose-1:1 10 5 2 5 3 6 3 3 3; mso-font-charset:0; mso-generic-font-family:roman; mso-font-pitch:variable; mso-font-signature:67110535 0 0 0 159 0;} @font-face {font-family:Vrinda; panose-1:1 1 6 0 1 1 1 1 1 1; mso-font-charset:0; mso-generic-font-family:auto; mso-font-pitch:variable; mso-font-signature:65539 0 0 0 1 0;} @font-face {font-family:Raavi; panose-1:2 0 5 0 0 0 0 0 0 0; mso-font-charset:0; mso-generic-font-family:auto; mso-font-pitch:variable; mso-font-signature:131075 0 0 0 1 0;} @font-face {font-family:Shruti; panose-1:2 0 5 0 0 0 0 0 0 0; mso-font-charset:0; mso-generic-font-family:auto; mso-font-pitch:variable; mso-font-signature:262147 0 0 0 1 0;} @font-face {font-family:Sendnya; panose-1:0 0 4 0 0 0 0 0 0 0; mso-font-charset:1; mso-generic-font-family:roman; mso-font-format:other; mso-font-pitch:variable; mso-font-signature:0 0 0 0 0 0;} @font-face {font-family:Gautami; panose-1:2 0 5 0 0 0 0 0 0 0; mso-font-charset:0; mso-generic-font-family:auto; mso-font-pitch:variable; mso-font-signature:2097155 0 0 0 1 0;} @font-face {font-family:Tunga; panose-1:0 0 4 0 0 0 0 0 0 0; mso-font-charset:0; mso-generic-font-family:auto; mso-font-pitch:variable; mso-font-signature:4194307 0 0 0 1 0;} @font-face {font-family:"Estrangelo Edessa"; panose-1:0 0 0 0 0 0 0 0 0 0; mso-font-charset:0; mso-generic-font-family:script; mso-font-pitch:variable; mso-font-signature:-2147459005 0 128 0 1 0;} @font-face {font-family:Kartika; panose-1:2 2 5 3 3 4 4 6 2 3; mso-font-charset:0; mso-generic-font-family:roman; mso-font-pitch:variable; mso-font-signature:8388611 0 0 0 1 0;} @font-face {font-family:"Arial Unicode MS"; panose-1:2 11 6 4 2 2 2 2 2 4; mso-font-charset:0; mso-generic-font-family:roman; mso-font-format:other; mso-font-pitch:variable; mso-font-signature:3 0 0 0 1 0;} @font-face {font-family:Tahoma; panose-1:2 11 6 4 3 5 4 4 2 4; mso-font-charset:0; mso-generic-font-family:swiss; mso-font-pitch:variable; mso-font-signature:1627421319 -2147483648 8 0 66047 0;} @font-face {font-family:Marlett; panose-1:0 0 0 0 0 0 0 0 0 0; mso-font-charset:2; mso-generic-font-family:auto; mso-font-pitch:variable; mso-font-signature:0 268435456 0 0 -2147483648 0;} @font-face {font-family:"Lucida Console"; panose-1:2 11 6 9 4 5 4 2 2 4; mso-font-charset:0; mso-generic-font-family:modern; mso-font-pitch:fixed; mso-font-signature:-2147482993 6144 0 0 31 0;} @font-face {font-family:"Lucida Sans Unicode"; panose-1:2 11 6 2 3 5 4 2 2 4; mso-font-charset:0; mso-generic-font-family:swiss; mso-font-pitch:variable; mso-font-signature:-2147476737 14699 0 0 63 0;} @font-face {font-family:Verdana; panose-1:2 11 6 4 3 5 4 4 2 4; mso-font-charset:0; mso-generic-font-family:swiss; mso-font-pitch:variable; mso-font-signature:536871559 0 0 0 415 0;} @font-face {font-family:"Arial Black"; panose-1:2 11 10 4 2 1 2 2 2 4; mso-font-charset:0; mso-generic-font-family:swiss; mso-font-pitch:variable; mso-font-signature:647 0 0 0 159 0;} @font-face {font-family:"Comic Sans MS"; panose-1:3 15 7 2 3 3 2 2 2 4; mso-font-charset:0; mso-generic-font-family:script; mso-font-pitch:variable; mso-font-signature:647 0 0 0 159 0;} @font-face {font-family:Impact; panose-1:2 11 8 6 3 9 2 5 2 4; mso-font-charset:0; mso-generic-font-family:swiss; mso-font-pitch:variable; mso-font-signature:647 0 0 0 159 0;} @font-face {font-family:Georgia; panose-1:2 4 5 2 5 4 5 2 3 3; mso-font-charset:0; mso-generic-font-family:roman; mso-font-pitch:variable; mso-font-signature:647 0 0 0 159 0;} @font-face {font-family:"Franklin Gothic Medium"; panose-1:2 11 6 3 2 1 2 2 2 4; mso-font-charset:0; mso-generic-font-family:swiss; mso-font-pitch:variable; mso-font-signature:647 0 0 0 159 0;} @font-face {font-family:"Palatino Linotype"; panose-1:2 4 5 2 5 5 5 3 3 4; mso-font-charset:0; mso-generic-font-family:roman; mso-font-pitch:variable; mso-font-signature:-536870009 1073741843 0 0 415 0;} @font-face {font-family:"Trebuchet MS"; panose-1:2 11 6 3 2 2 2 2 2 4; mso-font-charset:0; mso-generic-font-family:swiss; mso-font-pitch:variable; mso-font-signature:647 0 0 0 159 0;} @font-face {font-family:Webdings; panose-1:5 3 1 2 1 5 9 6 7 3; mso-font-charset:2; mso-generic-font-family:roman; mso-font-pitch:variable; mso-font-signature:0 268435456 0 0 -2147483648 0;} @font-face {font-family:"MV Boli"; mso-font-charset:0; mso-generic-font-family:auto; mso-font-pitch:variable; mso-font-signature:3 0 256 0 1 0;} @font-face {font-family:"Microsoft Sans Serif"; panose-1:2 11 6 4 2 2 2 2 2 4; mso-font-charset:0; mso-generic-font-family:swiss; mso-font-pitch:variable; mso-font-signature:1627421663 -2147483648 8 0 66047 0;} @font-face {font-family:"Agency FB"; panose-1:2 11 5 3 2 2 2 2 2 4; mso-font-charset:0; mso-generic-font-family:swiss; mso-font-pitch:variable; mso-font-signature:3 0 0 0 1 0;} @font-face {font-family:Algerian; panose-1:4 2 7 5 4 10 2 6 7 2; mso-font-charset:0; mso-generic-font-family:decorative; mso-font-pitch:variable; mso-font-signature:3 0 0 0 1 0;} @font-face {font-family:"Arial Narrow"; panose-1:2 11 5 6 2 2 2 3 2 4; mso-font-charset:0; mso-generic-font-family:swiss; mso-font-pitch:variable; mso-font-signature:647 0 0 0 159 0;} @font-face {font-family:"Arial Rounded MT Bold"; panose-1:2 15 7 4 3 5 4 3 2 4; mso-font-charset:0; mso-generic-font-family:swiss; mso-font-pitch:variable; mso-font-signature:3 0 0 0 1 0;} @font-face {font-family:"Baskerville Old Face"; panose-1:2 2 6 2 8 5 5 2 3 3; mso-font-charset:0; mso-generic-font-family:roman; mso-font-pitch:variable; mso-font-signature:3 0 0 0 1 0;} @font-face {font-family:"Bauhaus 93"; panose-1:4 3 9 5 2 11 2 2 12 2; mso-font-charset:0; mso-generic-font-family:decorative; mso-font-pitch:variable; mso-font-signature:3 0 0 0 1 0;} @font-face {font-family:"Bell MT"; panose-1:2 2 5 3 6 3 5 2 3 3; mso-font-charset:0; mso-generic-font-family:roman; mso-font-pitch:variable; mso-font-signature:3 0 0 0 1 0;} @font-face {font-family:"Berlin Sans FB"; panose-1:2 14 6 2 2 5 2 2 3 6; mso-font-charset:0; mso-generic-font-family:swiss; mso-font-pitch:variable; mso-font-signature:3 0 0 0 1 0;} @font-face {font-family:"Bernard MT Condensed"; panose-1:2 5 8 6 6 9 5 2 4 4; mso-font-charset:0; mso-generic-font-family:roman; mso-font-pitch:variable; mso-font-signature:3 0 0 0 1 0;} @font-face {font-family:"Blackadder ITC"; panose-1:4 2 5 5 5 16 7 2 13 2; mso-font-charset:0; mso-generic-font-family:decorative; mso-font-pitch:variable; mso-font-signature:3 0 0 0 1 0;} @font-face {font-family:"Bodoni MT"; panose-1:2 7 6 3 8 6 6 2 2 3; mso-font-charset:0; mso-generic-font-family:roman; mso-font-pitch:variable; mso-font-signature:3 0 0 0 1 0;} @font-face {font-family:"Bodoni MT Black"; panose-1:2 7 10 3 8 6 6 2 2 3; mso-font-charset:0; mso-generic-font-family:roman; mso-font-pitch:variable; mso-font-signature:3 0 0 0 1 0;} @font-face {font-family:"Bodoni MT Condensed"; panose-1:2 7 6 6 8 6 6 2 2 3; mso-font-charset:0; mso-generic-font-family:roman; mso-font-pitch:variable; mso-font-signature:3 0 0 0 1 0;} @font-face {font-family:"Bodoni MT Poster Compressed"; panose-1:2 7 7 6 8 6 1 5 2 4; mso-font-charset:0; mso-generic-font-family:roman; mso-font-pitch:variable; mso-font-signature:7 0 0 0 17 0;} @font-face {font-family:"Book Antiqua"; panose-1:2 4 6 2 5 3 5 3 3 4; mso-font-charset:0; mso-generic-font-family:roman; mso-font-pitch:variable; mso-font-signature:647 0 0 0 159 0;} @font-face {font-family:"Bookman Old Style"; panose-1:2 5 6 4 5 5 5 2 2 4; mso-font-charset:0; mso-generic-font-family:roman; mso-font-pitch:variable; mso-font-signature:647 0 0 0 159 0;} @font-face {font-family:"Bradley Hand ITC"; panose-1:3 7 4 2 5 3 2 3 2 3; mso-font-charset:0; mso-generic-font-family:script; mso-font-pitch:variable; mso-font-signature:3 0 0 0 1 0;} @font-face {font-family:"Britannic Bold"; panose-1:2 11 9 3 6 7 3 2 2 4; mso-font-charset:0; mso-generic-font-family:swiss; mso-font-pitch:variable; mso-font-signature:3 0 0 0 1 0;} @font-face {font-family:Broadway; panose-1:4 4 9 5 8 11 2 2 5 2; mso-font-charset:0; mso-generic-font-family:decorative; mso-font-pitch:variable; mso-font-signature:3 0 0 0 1 0;} @font-face {font-family:"Brush Script MT"; panose-1:3 6 8 2 4 4 6 7 3 4; mso-font-charset:0; mso-generic-font-family:script; mso-font-pitch:variable; mso-font-signature:3 0 0 0 1 0;} @font-face {font-family:"Californian FB"; panose-1:2 7 4 3 6 8 11 3 2 4; mso-font-charset:0; mso-generic-font-family:roman; mso-font-pitch:variable; mso-font-signature:3 0 0 0 1 0;} @font-face {font-family:"Calisto MT"; panose-1:2 4 6 3 5 5 5 3 3 4; mso-font-charset:0; mso-generic-font-family:roman; mso-font-pitch:variable; mso-font-signature:3 0 0 0 1 0;} @font-face {font-family:Castellar; panose-1:2 10 4 2 6 4 6 1 3 1; mso-font-charset:0; mso-generic-font-family:roman; mso-font-pitch:variable; mso-font-signature:3 0 0 0 1 0;} @font-face {font-family:Centaur; panose-1:2 3 5 4 5 2 5 2 3 4; mso-font-charset:0; mso-generic-font-family:roman; mso-font-pitch:variable; mso-font-signature:3 0 0 0 1 0;} @font-face {font-family:"Century Gothic"; panose-1:2 11 5 2 2 2 2 2 2 4; mso-font-charset:0; mso-generic-font-family:swiss; mso-font-pitch:variable; mso-font-signature:647 0 0 0 159 0;} @font-face {font-family:"Century Schoolbook"; panose-1:2 4 6 4 5 5 5 2 3 4; mso-font-charset:0; mso-generic-font-family:roman; mso-font-pitch:variable; mso-font-signature:647 0 0 0 159 0;} @font-face {font-family:Chiller; panose-1:4 2 4 4 3 16 7 2 6 2; mso-font-charset:0; mso-generic-font-family:decorative; mso-font-pitch:variable; mso-font-signature:3 0 0 0 1 0;} @font-face {font-family:"Colonna MT"; panose-1:4 2 8 5 6 2 2 3 2 3; mso-font-charset:0; mso-generic-font-family:decorative; mso-font-pitch:variable; mso-font-signature:3 0 0 0 1 0;} @font-face {font-family:"Cooper Black"; panose-1:2 8 9 4 4 3 11 2 4 4; mso-font-charset:0; mso-generic-font-family:roman; mso-font-pitch:variable; mso-font-signature:3 0 0 0 1 0;} @font-face {font-family:"Copperplate Gothic Bold"; panose-1:2 14 7 5 2 2 6 2 4 4; mso-font-charset:0; mso-generic-font-family:swiss; mso-font-pitch:variable; mso-font-signature:3 0 0 0 1 0;} @font-face {font-family:"Copperplate Gothic Light"; panose-1:2 14 5 7 2 2 6 2 4 4; mso-font-charset:0; mso-generic-font-family:swiss; mso-font-pitch:variable; mso-font-signature:3 0 0 0 1 0;} @font-face {font-family:"Curlz MT"; panose-1:4 4 4 4 5 7 2 2 2 2; mso-font-charset:0; mso-generic-font-family:decorative; mso-font-pitch:variable; mso-font-signature:3 0 0 0 1 0;} @font-face {font-family:"Edwardian Script ITC"; panose-1:3 3 3 2 4 7 7 13 8 4; mso-font-charset:0; mso-generic-font-family:script; mso-font-pitch:variable; mso-font-signature:3 0 0 0 1 0;} @font-face {font-family:Elephant; panose-1:2 2 9 4 9 5 5 2 3 3; mso-font-charset:0; mso-generic-font-family:roman; mso-font-pitch:variable; mso-font-signature:3 0 0 0 1 0;} @font-face {font-family:"Engravers MT"; panose-1:2 9 7 7 8 5 5 2 3 4; mso-font-charset:0; mso-generic-font-family:roman; mso-font-pitch:variable; mso-font-signature:3 0 0 0 1 0;} @font-face {font-family:"Eras Bold ITC"; panose-1:2 11 9 7 3 5 4 2 2 4; mso-font-charset:0; mso-generic-font-family:swiss; mso-font-pitch:variable; mso-font-signature:3 0 0 0 1 0;} @font-face {font-family:"Eras Demi ITC"; panose-1:2 11 8 5 3 5 4 2 8 4; mso-font-charset:0; mso-generic-font-family:swiss; mso-font-pitch:variable; mso-font-signature:3 0 0 0 1 0;} @font-face {font-family:"Eras Light ITC"; panose-1:2 11 4 2 3 5 4 2 8 4; mso-font-charset:0; mso-generic-font-family:swiss; mso-font-pitch:variable; mso-font-signature:3 0 0 0 1 0;} @font-face {font-family:"Eras Medium ITC"; panose-1:2 11 6 2 3 5 4 2 8 4; mso-font-charset:0; mso-generic-font-family:swiss; mso-font-pitch:variable; mso-font-signature:3 0 0 0 1 0;} @font-face {font-family:"Felix Titling"; panose-1:4 6 5 5 6 2 2 2 10 4; mso-font-charset:0; mso-generic-font-family:decorative; mso-font-pitch:variable; mso-font-signature:3 0 0 0 1 0;} @font-face {font-family:"Footlight MT Light"; panose-1:2 4 6 2 6 3 10 2 3 4; mso-font-charset:0; mso-generic-font-family:roman; mso-font-pitch:variable; mso-font-signature:3 0 0 0 1 0;} @font-face {font-family:Forte; panose-1:3 6 9 2 4 5 2 7 2 3; mso-font-charset:0; mso-generic-font-family:script; mso-font-pitch:variable; mso-font-signature:3 0 0 0 1 0;} @font-face {font-family:"Franklin Gothic Book"; panose-1:2 11 5 3 2 1 2 2 2 4; mso-font-charset:0; mso-generic-font-family:swiss; mso-font-pitch:variable; mso-font-signature:647 0 0 0 159 0;} @font-face {font-family:"Franklin Gothic Demi"; panose-1:2 11 7 3 2 1 2 2 2 4; mso-font-charset:0; mso-generic-font-family:swiss; mso-font-pitch:variable; mso-font-signature:647 0 0 0 159 0;} @font-face {font-family:"Franklin Gothic Demi Cond"; panose-1:2 11 7 6 3 4 2 2 2 4; mso-font-charset:0; mso-generic-font-family:swiss; mso-font-pitch:variable; mso-font-signature:647 0 0 0 159 0;} @font-face {font-family:"Franklin Gothic Heavy"; panose-1:2 11 9 3 2 1 2 2 2 4; mso-font-charset:0; mso-generic-font-family:swiss; mso-font-pitch:variable; mso-font-signature:647 0 0 0 159 0;} @font-face {font-family:"Franklin Gothic Medium Cond"; panose-1:2 11 6 6 3 4 2 2 2 4; mso-font-charset:0; mso-generic-font-family:swiss; mso-font-pitch:variable; mso-font-signature:647 0 0 0 159 0;} @font-face {font-family:"Freestyle Script"; panose-1:3 8 4 2 3 2 5 11 4 4; mso-font-charset:0; mso-generic-font-family:script; mso-font-pitch:variable; mso-font-signature:3 0 0 0 1 0;} @font-face {font-family:"French Script MT"; panose-1:3 2 4 2 4 6 7 4 6 5; mso-font-charset:0; mso-generic-font-family:script; mso-font-pitch:variable; mso-font-signature:3 0 0 0 1 0;} @font-face {font-family:Garamond; panose-1:2 2 4 4 3 3 1 1 8 3; mso-font-charset:0; mso-generic-font-family:roman; mso-font-pitch:variable; mso-font-signature:647 0 0 0 159 0;} @font-face {font-family:Gigi; panose-1:4 4 5 4 6 16 7 2 13 2; mso-font-charset:0; mso-generic-font-family:decorative; mso-font-pitch:variable; mso-font-signature:3 0 0 0 1 0;} @font-face {font-family:"Gill Sans MT Ext Condensed Bold"; panose-1:2 11 9 2 2 1 4 2 2 3; mso-font-charset:0; mso-generic-font-family:swiss; mso-font-pitch:variable; mso-font-signature:7 0 0 0 3 0;} @font-face {font-family:"Gill Sans MT"; panose-1:2 11 5 2 2 1 4 2 2 3; mso-font-charset:0; mso-generic-font-family:swiss; mso-font-pitch:variable; mso-font-signature:7 0 0 0 3 0;} @font-face {font-family:"Gill Sans MT Condensed"; panose-1:2 11 5 6 2 1 4 2 2 3; mso-font-charset:0; mso-generic-font-family:swiss; mso-font-pitch:variable; mso-font-signature:7 0 0 0 3 0;} @font-face {font-family:"Gill Sans Ultra Bold"; panose-1:2 11 10 2 2 1 4 2 2 3; mso-font-charset:0; mso-generic-font-family:swiss; mso-font-pitch:variable; mso-font-signature:7 0 0 0 3 0;} @font-face {font-family:"Gill Sans Ultra Bold Condensed"; panose-1:2 11 10 6 2 1 4 2 2 3; mso-font-charset:0; mso-generic-font-family:swiss; mso-font-pitch:variable; mso-font-signature:7 0 0 0 3 0;} @font-face {font-family:"Gloucester MT Extra Condensed"; panose-1:2 3 8 8 2 6 1 1 1 1; mso-font-charset:0; mso-generic-font-family:roman; mso-font-pitch:variable; mso-font-signature:3 0 0 0 1 0;} @font-face {font-family:"Goudy Old Style"; panose-1:2 2 5 2 5 3 5 2 3 3; mso-font-charset:0; mso-generic-font-family:roman; mso-font-pitch:variable; mso-font-signature:3 0 0 0 1 0;} @font-face {font-family:"Goudy Stout"; panose-1:2 2 9 4 7 3 11 2 4 1; mso-font-charset:0; mso-generic-font-family:roman; mso-font-pitch:variable; mso-font-signature:3 0 0 0 1 0;} @font-face {font-family:Haettenschweiler; panose-1:2 11 7 6 4 9 2 6 2 4; mso-font-charset:0; mso-generic-font-family:swiss; mso-font-pitch:variable; mso-font-signature:647 0 0 0 159 0;} @font-face {font-family:"Harlow Solid Italic"; panose-1:4 3 6 4 2 15 2 2 13 2; mso-font-charset:0; mso-generic-font-family:decorative; mso-font-pitch:variable; mso-font-signature:3 0 0 0 1 0;} @font-face {font-family:Harrington; panose-1:4 4 5 5 5 10 2 2 7 2; mso-font-charset:0; mso-generic-font-family:decorative; mso-font-pitch:variable; mso-font-signature:3 0 0 0 1 0;} @font-face {font-family:"High Tower Text"; panose-1:2 4 5 2 5 5 6 3 3 3; mso-font-charset:0; mso-generic-font-family:roman; mso-font-pitch:variable; mso-font-signature:3 0 0 0 1 0;} @font-face {font-family:"Imprint MT Shadow"; panose-1:4 2 6 5 6 3 3 3 2 2; mso-font-charset:0; mso-generic-font-family:decorative; mso-font-pitch:variable; mso-font-signature:3 0 0 0 1 0;} @font-face {font-family:Jokerman; panose-1:4 9 6 5 6 13 6 2 7 2; mso-font-charset:0; mso-generic-font-family:decorative; mso-font-pitch:variable; mso-font-signature:3 0 0 0 1 0;} @font-face {font-family:"Juice ITC"; panose-1:4 4 4 3 4 10 2 2 2 2; mso-font-charset:0; mso-generic-font-family:decorative; mso-font-pitch:variable; mso-font-signature:3 0 0 0 1 0;} @font-face {font-family:"Kristen ITC"; panose-1:3 5 5 2 4 2 2 3 2 2; mso-font-charset:0; mso-generic-font-family:script; mso-font-pitch:variable; mso-font-signature:3 0 0 0 1 0;} @font-face {font-family:"Kunstler Script"; panose-1:3 3 4 2 2 6 7 13 13 6; mso-font-charset:0; mso-generic-font-family:script; mso-font-pitch:variable; mso-font-signature:3 0 0 0 1 0;} @font-face {font-family:"Lucida Bright"; panose-1:2 4 6 2 5 5 5 2 3 4; mso-font-charset:0; mso-generic-font-family:roman; mso-font-pitch:variable; mso-font-signature:3 0 0 0 1 0;} @font-face {font-family:"Lucida Calligraphy"; panose-1:3 1 1 1 1 1 1 1 1 1; mso-font-charset:0; mso-generic-font-family:script; mso-font-pitch:variable; mso-font-signature:3 0 0 0 1 0;} @font-face {font-family:"Lucida Fax"; panose-1:2 6 6 2 5 5 5 2 2 4; mso-font-charset:0; mso-generic-font-family:roman; mso-font-pitch:variable; mso-font-signature:3 0 0 0 1 0;} @font-face {font-family:"Lucida Handwriting"; panose-1:3 1 1 1 1 1 1 1 1 1; mso-font-charset:0; mso-generic-font-family:script; mso-font-pitch:variable; mso-font-signature:3 0 0 0 1 0;} @font-face {font-family:"Lucida Sans"; panose-1:2 11 6 2 3 5 4 2 2 4; mso-font-charset:0; mso-generic-font-family:swiss; mso-font-pitch:variable; mso-font-signature:3 0 0 0 1 0;} @font-face {font-family:"Lucida Sans Typewriter"; panose-1:2 11 5 9 3 5 4 3 2 4; mso-font-charset:0; mso-generic-font-family:modern; mso-font-pitch:fixed; mso-font-signature:3 0 0 0 1 0;} @font-face {font-family:"MS Outlook"; panose-1:5 1 1 0 1 0 0 0 0 0; mso-font-charset:2; mso-generic-font-family:auto; mso-font-pitch:variable; mso-font-signature:0 268435456 0 0 -2147483648 0;} @font-face {font-family:Magneto; panose-1:4 3 8 5 5 8 2 2 13 2; mso-font-charset:0; mso-generic-font-family:decorative; mso-font-pitch:variable; mso-font-signature:3 0 0 0 1 0;} @font-face {font-family:"Maiandra GD"; panose-1:2 14 5 2 3 3 8 2 2 4; mso-font-charset:0; mso-generic-font-family:swiss; mso-font-pitch:variable; mso-font-signature:3 0 0 0 1 0;} @font-face {font-family:"Matura MT Script Capitals"; panose-1:3 2 8 2 6 6 2 7 2 2; mso-font-charset:0; mso-generic-font-family:script; mso-font-pitch:variable; mso-font-signature:3 0 0 0 1 0;} @font-face {font-family:Mistral; panose-1:3 9 7 2 3 4 7 2 4 3; mso-font-charset:0; mso-generic-font-family:script; mso-font-pitch:variable; mso-font-signature:647 0 0 0 159 0;} @font-face {font-family:"Modern No\. 20"; panose-1:2 7 7 4 7 5 5 2 3 3; mso-font-charset:0; mso-generic-font-family:roman; mso-font-pitch:variable; mso-font-signature:3 0 0 0 1 0;} @font-face {font-family:"Monotype Corsiva"; panose-1:3 1 1 1 1 2 1 1 1 1; mso-font-charset:0; mso-generic-font-family:script; mso-font-pitch:variable; mso-font-signature:647 0 0 0 159 0;} @font-face {font-family:"Niagara Engraved"; panose-1:4 2 5 2 7 7 3 3 2 2; mso-font-charset:0; mso-generic-font-family:decorative; mso-font-pitch:variable; mso-font-signature:3 0 0 0 1 0;} @font-face {font-family:"Niagara Solid"; panose-1:4 2 5 2 7 7 2 2 2 2; mso-font-charset:0; mso-generic-font-family:decorative; mso-font-pitch:variable; mso-font-signature:3 0 0 0 1 0;} @font-face {font-family:"OCR A Extended"; panose-1:2 1 5 9 2 1 2 1 3 3; mso-font-charset:0; mso-generic-font-family:modern; mso-font-pitch:variable; mso-font-signature:3 0 0 0 1 0;} @font-face {font-family:"Old English Text MT"; panose-1:3 4 9 2 4 5 8 3 8 6; mso-font-charset:0; mso-generic-font-family:script; mso-font-pitch:variable; mso-font-signature:3 0 0 0 1 0;} @font-face {font-family:Onyx; panose-1:4 5 6 2 8 7 2 2 2 3; mso-font-charset:0; mso-generic-font-family:decorative; mso-font-pitch:variable; mso-font-signature:3 0 0 0 1 0;} @font-face {font-family:"Palace Script MT"; panose-1:3 3 3 2 2 6 7 12 11 5; mso-font-charset:0; mso-generic-font-family:script; mso-font-pitch:variable; mso-font-signature:3 0 0 0 1 0;} @font-face {font-family:Papyrus; panose-1:3 7 5 2 6 5 2 3 2 5; mso-font-charset:0; mso-generic-font-family:script; mso-font-pitch:variable; mso-font-signature:3 0 0 0 1 0;} @font-face {font-family:Parchment; panose-1:3 4 6 2 4 7 8 4 8 4; mso-font-charset:0; mso-generic-font-family:script; mso-font-pitch:variable; mso-font-signature:3 0 0 0 1 0;} @font-face {font-family:Perpetua; panose-1:2 2 5 2 6 4 1 2 3 3; mso-font-charset:0; mso-generic-font-family:roman; mso-font-pitch:variable; mso-font-signature:3 0 0 0 1 0;} @font-face {font-family:"Perpetua Titling MT"; panose-1:2 2 5 2 6 5 5 2 8 4; mso-font-charset:0; mso-generic-font-family:roman; mso-font-pitch:variable; mso-font-signature:3 0 0 0 1 0;} @font-face {font-family:Playbill; panose-1:4 5 6 3 10 6 2 2 2 2; mso-font-charset:0; mso-generic-font-family:decorative; mso-font-pitch:variable; mso-font-signature:3 0 0 0 1 0;} @font-face {font-family:"Poor Richard"; panose-1:2 8 5 2 5 5 5 2 7 2; mso-font-charset:0; mso-generic-font-family:roman; mso-font-pitch:variable; mso-font-signature:3 0 0 0 1 0;} @font-face {font-family:Pristina; panose-1:3 6 4 2 4 4 6 8 2 4; mso-font-charset:0; mso-generic-font-family:script; mso-font-pitch:variable; mso-font-signature:3 0 0 0 1 0;} @font-face {font-family:"Rage Italic"; panose-1:3 7 5 2 4 5 7 7 3 4; mso-font-charset:0; mso-generic-font-family:script; mso-font-pitch:variable; mso-font-signature:3 0 0 0 1 0;} @font-face {font-family:Ravie; panose-1:4 4 8 5 5 8 9 2 6 2; mso-font-charset:0; mso-generic-font-family:decorative; mso-font-pitch:variable; mso-font-signature:3 0 0 0 1 0;} @font-face {font-family:Rockwell; panose-1:2 6 6 3 2 2 5 2 4 3; mso-font-charset:0; mso-generic-font-family:roman; mso-font-pitch:variable; mso-font-signature:3 0 0 0 1 0;} @font-face {font-family:"Rockwell Condensed"; panose-1:2 6 6 3 5 4 5 2 1 4; mso-font-charset:0; mso-generic-font-family:roman; mso-font-pitch:variable; mso-font-signature:3 0 0 0 1 0;} @font-face {font-family:"Rockwell Extra Bold"; panose-1:2 6 9 3 4 5 5 2 4 3; mso-font-charset:0; mso-generic-font-family:roman; mso-font-pitch:variable; mso-font-signature:3 0 0 0 1 0;} @font-face {font-family:"Informal Roman"; panose-1:3 6 4 2 3 4 6 11 2 4; mso-font-charset:0; mso-generic-font-family:script; mso-font-pitch:variable; mso-font-signature:3 0 0 0 1 0;} @font-face {font-family:"Script MT Bold"; panose-1:3 4 6 2 4 6 7 8 9 4; mso-font-charset:0; mso-generic-font-family:script; mso-font-pitch:variable; mso-font-signature:3 0 0 0 1 0;} @font-face {font-family:"Showcard Gothic"; panose-1:4 2 9 4 2 1 2 2 6 4; mso-font-charset:0; mso-generic-font-family:decorative; mso-font-pitch:variable; mso-font-signature:3 0 0 0 1 0;} @font-face {font-family:"Snap ITC"; panose-1:4 4 10 7 6 10 2 2 2 2; mso-font-charset:0; mso-generic-font-family:decorative; mso-font-pitch:variable; mso-font-signature:3 0 0 0 1 0;} @font-face {font-family:Stencil; panose-1:4 4 9 5 13 8 2 2 4 4; mso-font-charset:0; mso-generic-font-family:decorative; mso-font-pitch:variable; mso-font-signature:3 0 0 0 1 0;} @font-face {font-family:"Tw Cen MT"; panose-1:2 11 6 2 2 1 4 2 6 3; mso-font-charset:0; mso-generic-font-family:swiss; mso-font-pitch:variable; mso-font-signature:7 0 0 0 3 0;} @font-face {font-family:"Tw Cen MT Condensed"; panose-1:2 11 6 6 2 1 4 2 2 3; mso-font-charset:0; mso-generic-font-family:swiss; mso-font-pitch:variable; mso-font-signature:7 0 0 0 3 0;} @font-face {font-family:"Tempus Sans ITC"; panose-1:4 2 4 4 3 13 7 2 2 2; mso-font-charset:0; mso-generic-font-family:decorative; mso-font-pitch:variable; mso-font-signature:3 0 0 0 1 0;} @font-face {font-family:"Viner Hand ITC"; panose-1:3 7 5 2 3 5 2 2 2 3; mso-font-charset:0; mso-generic-font-family:script; mso-font-pitch:variable; mso-font-signature:3 0 0 0 1 0;} @font-face {font-family:Vivaldi; panose-1:3 2 6 2 5 5 6 9 8 4; mso-font-charset:0; mso-generic-font-family:script; mso-font-pitch:variable; mso-font-signature:3 0 0 0 1 0;} @font-face {font-family:"Vladimir Script"; panose-1:3 5 4 2 4 4 7 7 3 5; mso-font-charset:0; mso-generic-font-family:script; mso-font-pitch:variable; mso-font-signature:3 0 0 0 1 0;} @font-face {font-family:"Wide Latin"; panose-1:2 10 10 7 5 5 5 2 4 4; mso-font-charset:0; mso-generic-font-family:roman; mso-font-pitch:variable; mso-font-signature:3 0 0 0 1 0;} @font-face {font-family:"Wingdings 2"; panose-1:5 2 1 2 1 5 7 7 7 7; mso-font-charset:2; mso-generic-font-family:roman; mso-font-pitch:variable; mso-font-signature:0 268435456 0 0 -2147483648 0;} @font-face {font-family:"Wingdings 3"; panose-1:5 4 1 2 1 8 7 7 7 7; mso-font-charset:2; mso-generic-font-family:roman; mso-font-pitch:variable; mso-font-signature:0 268435456 0 0 -2147483648 0;} @font-face {font-family:"Berlin Sans FB Demi"; panose-1:2 14 8 2 2 5 2 2 3 6; mso-font-charset:0; mso-generic-font-family:swiss; mso-font-pitch:variable; mso-font-signature:3 0 0 0 1 0;} @font-face {font-family:"Bookshelf Symbol 7"; panose-1:5 1 1 1 1 1 1 1 1 1; mso-font-charset:2; mso-generic-font-family:auto; mso-font-pitch:variable; mso-font-signature:0 268435456 0 0 -2147483648 0;} @font-face {font-family:"MS Reference Sans Serif"; panose-1:2 11 6 4 3 5 4 4 2 4; mso-font-charset:0; mso-generic-font-family:swiss; mso-font-pitch:variable; mso-font-signature:536871559 0 0 0 415 0;} @font-face {font-family:"MS Reference Specialty"; panose-1:5 0 5 0 0 0 0 0 0 0; mso-font-charset:2; mso-generic-font-family:auto; mso-font-pitch:variable; mso-font-signature:0 268435456 0 0 -2147483648 0;} @font-face {font-family:"Tw Cen MT Condensed Extra Bold"; panose-1:2 11 8 3 2 2 2 2 2 4; mso-font-charset:0; mso-generic-font-family:swiss; mso-font-pitch:variable; mso-font-signature:7 0 0 0 3 0;} @font-face {font-family:"Bitstream Vera Sans"; panose-1:2 11 6 3 3 8 4 2 2 4; mso-font-charset:0; mso-generic-font-family:swiss; mso-font-pitch:variable; mso-font-signature:-2147483473 268443722 0 0 1 0;} @font-face {font-family:"Bitstream Vera Serif"; panose-1:2 6 6 3 5 6 5 2 2 4; mso-font-charset:0; mso-generic-font-family:roman; mso-font-pitch:variable; mso-font-signature:-2147483473 268443722 0 0 1 0;} @font-face {font-family:"Bitstream Vera Sans Mono"; panose-1:2 11 6 9 3 8 4 2 2 4; mso-font-charset:0; mso-generic-font-family:modern; mso-font-pitch:fixed; mso-font-signature:-2147483473 268443722 0 0 1 0;} @font-face {font-family:OpenSymbol; panose-1:5 1 0 0 0 0 0 0 0 0; mso-font-charset:0; mso-generic-font-family:auto; mso-font-pitch:variable; mso-font-signature:-2147483473 268558570 0 0 1 0;} /* Style Definitions */ p.MsoNormal, li.MsoNormal, div.MsoNormal {mso-style-parent:""; margin:0in; margin-bottom:.0001pt; mso-pagination:widow-orphan; font-size:12.0pt; font-family:"Times New Roman"; mso-fareast-font-family:"Times New Roman";} a:link, span.MsoHyperlink {color:blue; text-decoration:underline; text-underline:single;} a:visited, span.MsoHyperlinkFollowed {color:purple; text-decoration:underline; text-underline:single;} p.xl22, li.xl22, div.xl22 {mso-style-name:xl22; mso-margin-top-alt:auto; margin-right:0in; mso-margin-bottom-alt:auto; margin-left:0in; mso-pagination:widow-orphan; border:none; mso-border-top-alt:solid windowtext .5pt; mso-border-left-alt:solid windowtext .5pt; padding:0in; mso-padding-alt:0in 0in 0in 0in; font-size:12.0pt; font-family:"Times New Roman"; mso-fareast-font-family:"Times New Roman";} p.xl23, li.xl23, div.xl23 {mso-style-name:xl23; mso-margin-top-alt:auto; margin-right:0in; mso-margin-bottom-alt:auto; margin-left:0in; mso-pagination:widow-orphan; border:none; mso-border-top-alt:solid windowtext .5pt; padding:0in; mso-padding-alt:0in 0in 0in 0in; font-size:12.0pt; font-family:"Times New Roman"; mso-fareast-font-family:"Times New Roman";} p.xl24, li.xl24, div.xl24 {mso-style-name:xl24; mso-margin-top-alt:auto; margin-right:0in; mso-margin-bottom-alt:auto; margin-left:0in; mso-pagination:widow-orphan; border:none; mso-border-top-alt:solid windowtext .5pt; mso-border-right-alt:solid windowtext .5pt; padding:0in; mso-padding-alt:0in 0in 0in 0in; font-size:12.0pt; font-family:"Times New Roman"; mso-fareast-font-family:"Times New Roman";} p.xl25, li.xl25, div.xl25 {mso-style-name:xl25; mso-margin-top-alt:auto; margin-right:0in; mso-margin-bottom-alt:auto; margin-left:0in; mso-pagination:widow-orphan; border:none; mso-border-left-alt:solid windowtext .5pt; padding:0in; mso-padding-alt:0in 0in 0in 0in; font-size:12.0pt; font-family:"Times New Roman"; mso-fareast-font-family:"Times New Roman";} p.xl27, li.xl27, div.xl27 {mso-style-name:xl27; mso-margin-top-alt:auto; margin-right:0in; mso-margin-bottom-alt:auto; margin-left:0in; mso-pagination:widow-orphan; border:none; mso-border-right-alt:solid windowtext .5pt; padding:0in; mso-padding-alt:0in 0in 0in 0in; font-size:12.0pt; font-family:"Times New Roman"; mso-fareast-font-family:"Times New Roman";} p.xl28, li.xl28, div.xl28 {mso-style-name:xl28; mso-margin-top-alt:auto; margin-right:0in; mso-margin-bottom-alt:auto; margin-left:0in; mso-pagination:widow-orphan; border:none; mso-border-left-alt:solid windowtext .5pt; mso-border-bottom-alt:solid windowtext .5pt; padding:0in; mso-padding-alt:0in 0in 0in 0in; font-size:12.0pt; font-family:"Times New Roman"; mso-fareast-font-family:"Times New Roman";} p.xl29, li.xl29, div.xl29 {mso-style-name:xl29; mso-margin-top-alt:auto; margin-right:0in; mso-margin-bottom-alt:auto; margin-left:0in; mso-pagination:widow-orphan; border:none; mso-border-bottom-alt:solid windowtext .5pt; padding:0in; mso-padding-alt:0in 0in 0in 0in; font-size:12.0pt; font-family:"Times New Roman"; mso-fareast-font-family:"Times New Roman";} p.xl30, li.xl30, div.xl30 {mso-style-name:xl30; mso-margin-top-alt:auto; margin-right:0in; mso-margin-bottom-alt:auto; margin-left:0in; mso-pagination:widow-orphan; border:none; mso-border-bottom-alt:solid windowtext .5pt; mso-border-right-alt:solid windowtext .5pt; padding:0in; mso-padding-alt:0in 0in 0in 0in; font-size:12.0pt; font-family:"Times New Roman"; mso-fareast-font-family:"Times New Roman";} p.xl31, li.xl31, div.xl31 {mso-style-name:xl31; mso-margin-top-alt:auto; margin-right:0in; mso-margin-bottom-alt:auto; margin-left:0in; text-align:right; mso-pagination:widow-orphan; border:none; mso-border-top-alt:solid windowtext .5pt; mso-border-left-alt:solid windowtext .5pt; padding:0in; mso-padding-alt:0in 0in 0in 0in; font-size:12.0pt; font-family:"Times New Roman"; mso-fareast-font-family:"Times New Roman";} p.xl32, li.xl32, div.xl32 {mso-style-name:xl32; mso-margin-top-alt:auto; margin-right:0in; mso-margin-bottom-alt:auto; margin-left:0in; text-align:center; mso-pagination:widow-orphan; border:none; mso-border-top-alt:solid windowtext .5pt; padding:0in; mso-padding-alt:0in 0in 0in 0in; font-size:12.0pt; font-family:"Times New Roman"; mso-fareast-font-family:"Times New Roman";} p.xl33, li.xl33, div.xl33 {mso-style-name:xl33; mso-margin-top-alt:auto; margin-right:0in; mso-margin-bottom-alt:auto; margin-left:0in; text-align:center; mso-pagination:widow-orphan; border:none; mso-border-top-alt:solid windowtext .5pt; padding:0in; mso-padding-alt:0in 0in 0in 0in; font-size:12.0pt; font-family:"Times New Roman"; mso-fareast-font-family:"Times New Roman";} p.xl34, li.xl34, div.xl34 {mso-style-name:xl34; mso-margin-top-alt:auto; margin-right:0in; mso-margin-bottom-alt:auto; margin-left:0in; text-align:center; mso-pagination:widow-orphan; border:none; mso-border-top-alt:solid windowtext .5pt; mso-border-right-alt:solid windowtext .5pt; padding:0in; mso-padding-alt:0in 0in 0in 0in; font-size:12.0pt; font-family:"Times New Roman"; mso-fareast-font-family:"Times New Roman";} p.xl35, li.xl35, div.xl35 {mso-style-name:xl35; mso-margin-top-alt:auto; margin-right:0in; mso-margin-bottom-alt:auto; margin-left:0in; mso-pagination:widow-orphan; border:none; mso-border-top-alt:solid windowtext .5pt; padding:0in; mso-padding-alt:0in 0in 0in 0in; font-size:12.0pt; font-family:"Times New Roman"; mso-fareast-font-family:"Times New Roman";} p.xl36, li.xl36, div.xl36 {mso-style-name:xl36; mso-margin-top-alt:auto; margin-right:0in; mso-margin-bottom-alt:auto; margin-left:0in; mso-pagination:widow-orphan; border:none; mso-border-top-alt:solid windowtext .5pt; padding:0in; mso-padding-alt:0in 0in 0in 0in; font-size:12.0pt; font-family:"Times New Roman"; mso-fareast-font-family:"Times New Roman";} p.xl37, li.xl37, div.xl37 {mso-style-name:xl37; mso-margin-top-alt:auto; margin-right:0in; mso-margin-bottom-alt:auto; margin-left:0in; mso-pagination:widow-orphan; border:none; mso-border-top-alt:solid windowtext .5pt; padding:0in; mso-padding-alt:0in 0in 0in 0in; font-size:12.0pt; font-family:"Times New Roman"; mso-fareast-font-family:"Times New Roman";} p.xl38, li.xl38, div.xl38 {mso-style-name:xl38; mso-margin-top-alt:auto; margin-right:0in; mso-margin-bottom-alt:auto; margin-left:0in; mso-pagination:widow-orphan; border:none; mso-border-top-alt:solid windowtext .5pt; mso-border-right-alt:solid windowtext .5pt; padding:0in; mso-padding-alt:0in 0in 0in 0in; font-size:12.0pt; font-family:"Times New Roman"; mso-fareast-font-family:"Times New Roman";} p.xl39, li.xl39, div.xl39 {mso-style-name:xl39; mso-margin-top-alt:auto; margin-right:0in; mso-margin-bottom-alt:auto; margin-left:0in; text-align:right; mso-pagination:widow-orphan; border:none; mso-border-left-alt:solid windowtext .5pt; padding:0in; mso-padding-alt:0in 0in 0in 0in; font-size:12.0pt; font-family:"Times New Roman"; mso-fareast-font-family:"Times New Roman";} p.xl40, li.xl40, div.xl40 {mso-style-name:xl40; mso-margin-top-alt:auto; margin-right:0in; mso-margin-bottom-alt:auto; margin-left:0in; text-align:center; mso-pagination:widow-orphan; font-size:12.0pt; font-family:"Times New Roman"; mso-fareast-font-family:"Times New Roman";} p.xl43, li.xl43, div.xl43 {mso-style-name:xl43; mso-margin-top-alt:auto; margin-right:0in; mso-margin-bottom-alt:auto; margin-left:0in; mso-pagination:widow-orphan; border:none; mso-border-right-alt:solid windowtext .5pt; padding:0in; mso-padding-alt:0in 0in 0in 0in; font-size:12.0pt; font-family:"Times New Roman"; mso-fareast-font-family:"Times New Roman";} p.xl44, li.xl44, div.xl44 {mso-style-name:xl44; mso-margin-top-alt:auto; margin-right:0in; mso-margin-bottom-alt:auto; margin-left:0in; mso-pagination:widow-orphan; border:none; mso-border-right-alt:solid windowtext .5pt; padding:0in; mso-padding-alt:0in 0in 0in 0in; font-size:12.0pt; font-family:"Times New Roman"; mso-fareast-font-family:"Times New Roman";} p.xl45, li.xl45, div.xl45 {mso-style-name:xl45; mso-margin-top-alt:auto; margin-right:0in; mso-margin-bottom-alt:auto; margin-left:0in; text-align:right; mso-pagination:widow-orphan; border:none; mso-border-left-alt:solid windowtext .5pt; mso-border-bottom-alt:solid windowtext .5pt; padding:0in; mso-padding-alt:0in 0in 0in 0in; font-size:12.0pt; font-family:"Times New Roman"; mso-fareast-font-family:"Times New Roman";} p.xl46, li.xl46, div.xl46 {mso-style-name:xl46; mso-margin-top-alt:auto; margin-right:0in; mso-margin-bottom-alt:auto; margin-left:0in; mso-pagination:widow-orphan; border:none; mso-border-bottom-alt:solid windowtext .5pt; padding:0in; mso-padding-alt:0in 0in 0in 0in; font-size:12.0pt; font-family:"Times New Roman"; mso-fareast-font-family:"Times New Roman";} p.xl47, li.xl47, div.xl47 {mso-style-name:xl47; mso-margin-top-alt:auto; margin-right:0in; mso-margin-bottom-alt:auto; margin-left:0in; mso-pagination:widow-orphan; border:none; mso-border-bottom-alt:solid windowtext .5pt; padding:0in; mso-padding-alt:0in 0in 0in 0in; font-size:12.0pt; font-family:"Times New Roman"; mso-fareast-font-family:"Times New Roman";} p.xl48, li.xl48, div.xl48 {mso-style-name:xl48; mso-margin-top-alt:auto; margin-right:0in; mso-margin-bottom-alt:auto; margin-left:0in; mso-pagination:widow-orphan; border:none; mso-border-bottom-alt:solid windowtext .5pt; padding:0in; mso-padding-alt:0in 0in 0in 0in; font-size:12.0pt; font-family:"Times New Roman"; mso-fareast-font-family:"Times New Roman";} p.xl49, li.xl49, div.xl49 {mso-style-name:xl49; mso-margin-top-alt:auto; margin-right:0in; mso-margin-bottom-alt:auto; margin-left:0in; mso-pagination:widow-orphan; border:none; mso-border-bottom-alt:solid windowtext .5pt; mso-border-right-alt:solid windowtext .5pt; padding:0in; mso-padding-alt:0in 0in 0in 0in; font-size:12.0pt; font-family:"Times New Roman"; mso-fareast-font-family:"Times New Roman";} ins {mso-style-type:export-only; text-decoration:none;} span.msoIns {mso-style-type:export-only; mso-style-name:""; text-decoration:underline; text-underline:single;} span.msoDel {mso-style-type:export-only; mso-style-name:""; text-decoration:line-through; display:none; color:red;} @page Section1 {size:8.5in 11.0in; margin:1.0in 1.25in 1.0in 1.25in; mso-header-margin:.5in; mso-footer-margin:.5in; mso-paper-source:0;} div.Section1 {page:Section1;} -->

A1: Towns Ranked by Share of Owner-Occupied Housing Units
A2: Affordable to 4-person Households Earning
A3: 80% of Boston Metropolitan Area Median Income
A4: Rank | C4: Town | D4: Percent Affordable | E4: Affordable Owner-Occupied Stock | F4: Total Stock
A5: =RANK(D5,$D$5:$D$146) -> 1 | C5: Avon | D5: =E5/F5 -> 0.5068415051311288 | E5: 889 | F5: 1754
A6: =RANK(D6,$D$5:$D$146) -> 2 | C6: Wilmington | D6: =E6/F6 -> 0.46960305947514175 | E6: 3561 | F6: 7583
A7: =RANK(D7,$D$5:$D$146) -> 3 | C7: Tewksbury | D7: =E7/F7 -> 0.46403734400304847 | E7: 4871 | F7: 10497
A8: =RANK(D8,$D$5:$D$146) -> 4 | C8: Holbrook | D8: =E8/F8 -> 0.46139359698681731 | E8: 1960 | F8: 4248
A9: =RANK(D9,$D$5:$D$146) -> 5 | C9: Randolph | D9: =E9/F9 -> 0.46121503346490478 | E9: 5375 | F9: 11654
A10: =RANK(D10,$D$5:$D$146) -> 6 | C10: Billerica | D10: =E10/F10 -> 0.45249457700650758 | E10: 6258 | F10: 13830
A11: =RANK(D11,$D$5:$D$146) -> 7 | C11: Whitman | D11: =E11/F11 -> 0.45238095238095238 | E11: 2394 | F11: 5292
A12: =RANK(D12,$D$5:$D$146) -> 8 | C12: Dracut | D12: =E12/F12 -> 0.45212196861626247 | E12: 5071 | F12: 11216
A13: =RANK(D13,$D$5:$D$146) -> 9 | C13: West Bridgewater | D13: =E13/F13 -> 0.44312067640276709 | E13: 1153 | F13: 2602
A14: =RANK(D14,$D$5:$D$146) -> 10 | C14: Burlington | D14: =E14/F14 -> 0.44024085435128379 | E14: 3875 | F14: 8802
A15: =RANK(D15,$D$5:$D$146) -> 11 | C15: Groveland | D15: =E15/F15 -> 0.41999082989454378 | E15: 916 | F15: 2181
A16: =RANK(D16,$D$5:$D$146) -> 12 | C16: Maynard | D16: =E16/F16 -> 0.40779103805449224 | E16: 1811 | F16: 4441
A17: =RANK(D17,$D$5:$D$146) -> 13 | C17: Methuen | D17: =E17/F17 -> 0.40528684555346667 | E17: 7114 | F17: 17553
A18: =RANK(D18,$D$5:$D$146) -> 14 | C18: East Bridgewater | D18: =E18/F18 -> 0.40209715386261502 | E18: 1879 | F18: 4673
A19: =RANK(D19,$D$5:$D$146) -> 15 | C19: Halifax | D19: =E19/F19 -> 0.39809926082365366 | E19: 1131 | F19: 2841
A20: =RANK(D20,$D$5:$D$146) -> 16 | C20: Stoughton | D20: =E20/F20 -> 0.3974059904824111 | E20: 4259 | F20: 10717
A21: =RANK(D21,$D$5:$D$146) -> 17 | C21: Abington | D21: =E21/F21 -> 0.38932839589294732 | E21: 2313 | F21: 5941
A22: =RANK(D22,$D$5:$D$146) -> 18 | C22: Hanson | D22: =E22/F22 -> 0.38671519563239309 | E22: 1275 | F22: 3297
A23: =RANK(D23,$D$5:$D$146) -> 19 | C23: Dedham | D23: =E23/F23 -> 0.38167859736487186 | E23: 3679 | F23: 9639
A24: =RANK(D24,$D$5:$D$146) -> 20 | C24: Raynham | D24: =E24/F24 -> 0.38165994481001908 | E24: 1798 | F24: 4711
A25: =RANK(D25,$D$5:$D$146) -> 21 | C25: Braintree | D25: =E25/F25 -> 0.37334337349397589 | E25: 4958 | F25: 13280
A26: =RANK(D26,$D$5:$D$146) -> 22 | C26: Hudson | D26: =E26/F26 -> 0.37265450728250887 | E26: 2840 | F26: 7621
A27: =RANK(D27,$D$5:$D$146) -> 23 | C27: Middleborough | D27: =E27/F27 -> 0.37156913516312789 | E27: 2870 | F27: 7724
A28: =RANK(D28,$D$5:$D$146) -> 24 | C28: Pembroke | D28: =E28/F28 -> 0.36531828159297586 | E28: 2330 | F28: 6378
A29: =RANK(D29,$D$5:$D$146) -> 25 | C29: Rockland | D29: =E29/F29 -> 0.36321873147599287 | E29: 2451 | F29: 6748
A30: =RANK(D30,$D$5:$D$146) -> 26 | C30: Carver | D30: =E30/F30 -> 0.36157658720793012 | E30: 1532 | F30: 4237
A31: =RANK(D31,$D$5:$D$146) -> 27 | C31: Chelmsford | D31: =E31/F31 -> 0.36015870639317266 | E31: 4811 | F31: 13358
A32: =RANK(D32,$D$5:$D$146) -> 28 | C32: Saugus | D32: =E32/F32 -> 0.36003495484998543 | E32: 3708 | F32: 10299
A33: =RANK(D33,$D$5:$D$146) -> 29 | C33: Norton | D33: =E33/F33 -> 0.3537138389366693 | E33: 2262 | F33: 6395
A34: =RANK(D34,$D$5:$D$146) -> 30 | C34: Millis | D34: =E34/F34 -> 0.34231378763866877 | E34: 1080 | F34: 3155
A35: =RANK(D35,$D$5:$D$146) -> 31 | C35: Ashland | D35: =E35/F35 -> 0.33707509881422926 | E35: 2132 | F35: 6325
A36: =RANK(D36,$D$5:$D$146) -> 32 | C36: Milford | D36: =E36/F36 -> 0.33203053990183601 | E36: 3653 | F36: 11002
A37: =RANK(D37,$D$5:$D$146) -> 33 | C37: Brockton | D37: =E37/F37 -> 0.32755622701747383 | E37: 11491 | F37: 35081
A38: =RANK(D38,$D$5:$D$146) -> 34 | C38: Woburn | D38: =E38/F38 -> 0.32409954977488742 | E38: 5183 | F38: 15992
A39: =RANK(D39,$D$5:$D$146) -> 35 | C39: Weymouth | D39: =E39/F39 -> 0.3224325377918309 | E39: 7444 | F39: 23087
A40: =RANK(D40,$D$5:$D$146) -> 36 | C40: Littleton | D40: =E40/F40 -> 0.32012288786482335 | E40: 1042 | F40: 3255
A41: =RANK(D41,$D$5:$D$146) -> 37 | C41: Walpole | D41: =E41/F41 -> 0.31934203062960864 | E41: 2815 | F41: 8815
A42: =RANK(D42,$D$5:$D$146) -> 38 | C42: Plymouth | D42: =E42/F42 -> 0.31713498132669393 | E42: 7133 | F42: 22492
A43: =RANK(D43,$D$5:$D$146) -> 39 | C43: Georgetown | D43: =E43/F43 -> 0.30443616661022688 | E43: 899 | F43: 2953
A44: =RANK(D44,$D$5:$D$146) -> 40 | C44: Easton | D44: =E44/F44 -> 0.29798742138364781 | E44: 2369 | F44: 7950
A45: =RANK(D45,$D$5:$D$146) -> 41 | C45: Danvers | D45: =E45/F45 -> 0.29702970297029702 | E45: 3060 | F45: 10302
A46: =RANK(D46,$D$5:$D$146) -> 42 | C46: Plainville | D46: =E46/F46 -> 0.29240310077519382 | E46: 943 | F46: 3225
A47: =RANK(D47,$D$5:$D$146) -> 43 | C47: Peabody | D47: =E47/F47 -> 0.28446581859551145 | E47: 5501 | F47: 19338
A48: =RANK(D48,$D$5:$D$146) -> 44 | C48: Foxborough | D48: =E48/F48 -> 0.28288455586505723 | E48: 1828 | F48: 6462
A49: =RANK(D49,$D$5:$D$146) -> 45 | C49: Holliston | D49: =E49/F49 -> 0.28277378097521982 | E49: 1415 | F49: 5004
A50: =RANK(D50,$D$5:$D$146) -> 46 | C50: Marshfield | D50: =E50/F50 -> 0.28014184397163122 | E50: 2844 | F50: 10152
A51: =RANK(D51,$D$5:$D$146) -> 47 | C51: Haverhill | D51: =E51/F51 -> 0.27580239792344774 | E51: 6694 | F51: 24271
A52: =RANK(D52,$D$5:$D$146) -> 48 | C52: Natick | D52: =E52/F52 -> 0.27506014434643145 | E52: 3773 | F52: 13717
A53: =RANK(D53,$D$5:$D$146) -> 49 | C53: Bridgewater | D53: =E53/F53 -> 0.27384538152610444 | E53: 2182 | F53: 7968
A54: =RANK(D54,$D$5:$D$146) -> 50 | C54: Franklin | D54: =E54/F54 -> 0.27045908183632733 | E54: 2981 | F54: 11022
A55: =RANK(D55,$D$5:$D$146) -> 51 | C55: Marlborough | D55: =E55/F55 -> 0.26213898347837056 | E55: 4157 | F55: 15858
A56: =RANK(D56,$D$5:$D$146) -> 52 | C56: Kingston | D56: =E56/F56 -> 0.25994919559695173 | E56: 1228 | F56: 4724
A57: =RANK(D57,$D$5:$D$146) -> 53 | C57: Taunton | D57: =E57/F57 -> 0.25965545388151395 | E57: 6044 | F57: 23277
A58: =RANK(D58,$D$5:$D$146) -> 54 | C58: Medway | D58: =E58/F58 -> 0.25776397515527949 | E58: 1162 | F58: 4508
A59: =RANK(D59,$D$5:$D$146) -> 55 | C59: Wrentham | D59: =E59/F59 -> 0.2577127659574468 | E59: 969 | F59: 3760
A60: =RANK(D60,$D$5:$D$146) -> 56 | C60: Wakefield | D60: =E60/F60 -> 0.25680473372781065 | E60: 2604 | F60: 10140
A61: =RANK(D61,$D$5:$D$146) -> 57 | C61: Middleton | D61: =E61/F61 -> 0.25542635658914731 | E61: 659 | F61: 2580
A62: =RANK(D62,$D$5:$D$146) -> 58 | C62: Norwood | D62: =E62/F62 -> 0.25207503320053121 | E62: 3037 | F62: 12048
A63: =RANK(D63,$D$5:$D$146) -> 59 | C63: Sharon | D63: =E63/F63 -> 0.2517551020408163 | E63: 1542 | F63: 6125
A64: =RANK(D64,$D$5:$D$146) -> 60 | C64: Stoneham | D64: =E64/F64 -> 0.24917227384385346 | E64: 2333 | F64: 9363
A65: =RANK(D65,$D$5:$D$146) -> 61 | C65: Salisbury | D65: =E65/F65 -> 0.24704244954766874 | E65: 1065 | F65: 4311
A66: =RANK(D66,$D$5:$D$146) -> 62 | C66: Merrimac | D66: =E66/F66 -> 0.24629934210526316 | E66: 599 | F66: 2432
A67: =RANK(D67,$D$5:$D$146) -> 63 | C67: Westford | D67: =E67/F67 -> 0.23980556305698084 | E67: 1776 | F67: 7406
A68: =RANK(D68,$D$5:$D$146) -> 64 | C68: Mansfield | D68: =E68/F68 -> 0.23688244310812404 | E68: 2009 | F68: 8481
A69: =RANK(D69,$D$5:$D$146) -> 65 | C69: Framingham | D69: =E69/F69 -> 0.22980164489598451 | E69: 6175 | F69: 26871
A70: =RANK(D70,$D$5:$D$146) -> 66 | C70: Melrose | D70: =E70/F70 -> 0.2287436829506162 | E70: 2580 | F70: 11279
A71: =RANK(D71,$D$5:$D$146) -> 67 | C71: Norfolk | D71: =E71/F71 -> 0.22447622214832058 | E71: 675 | F71: 3007
A72: =RANK(D72,$D$5:$D$146) -> 68 | C72: Hanover | D72: =E72/F72 -> 0.22389324295700064 | E72: 1057 | F72: 4721
A73: =RANK(D73,$D$5:$D$146) -> 69 | C73: North Reading | D73: =E73/F73 -> 0.22116339090728609 | E73: 1114 | F73: 5037
A74: =RANK(D74,$D$5:$D$146) -> 70 | C74: Amesbury | D74: =E74/F74 -> 0.22007665094339623 | E74: 1493 | F74: 6784
A75: =RANK(D75,$D$5:$D$146) -> 71 | C75: Lynn | D75: =E75/F75 -> 0.21550392033422996 | E75: 7531 | F75: 34946
A76: =RANK(D76,$D$5:$D$146) -> 72 | C76: Hamilton | D76: =E76/F76 -> 0.20539419087136929 | E76: 594 | F76: 2892
A77: =RANK(D77,$D$5:$D$146) -> 73 | C77: Stow | D77: =E77/F77 -> 0.20382442416340721 | E77: 469 | F77: 2301
A78: =RANK(D78,$D$5:$D$146) -> 74 | C78: Rowley | D78: =E78/F78 -> 0.19933554817275748 | E78: 420 | F78: 2107
A79: =RANK(D79,$D$5:$D$146) -> 75 | C79: Newbury | D79: =E79/F79 -> 0.19282511210762332 | E79: 559 | F79: 2899
A80: =RANK(D80,$D$5:$D$146) -> 76 | C80: Lowell | D80: =E80/F80 -> 0.19160436451808446 | E80: 7586 | F80: 39592
A81: =RANK(D81,$D$5:$D$146) -> 77 | C81: Hopkinton | D81: =E81/F81 -> 0.18841166936790923 | E81: 930 | F81: 4936
A82: =RANK(D82,$D$5:$D$146) -> 78 | C82: Waltham | D82: =E82/F82 -> 0.18765098472751096 | E82: 4583 | F82: 24423
A83: =RANK(D83,$D$5:$D$146) -> 79 | C83: Newburyport | D83: =E83/F83 -> 0.18750762474075883 | E83: 1537 | F83: 8197
A84: =RANK(D84,$D$5:$D$146) -> 80 | C84: Beverly | D84: =E84/F84 -> 0.18635587014888944 | E84: 3054 | F84: 16388
A85: =RANK(D85,$D$5:$D$146) -> 81 | C85: Reading | D85: =E85/F85 -> 0.18387909319899245 | E85: 1679 | F85: 9131
A86: =RANK(D86,$D$5:$D$146) -> 82 | C86: Canton | D86: =E86/F86 -> 0.18018018018018017 | E86: 1520 | F86: 8436
A87: =RANK(D87,$D$5:$D$146) -> 83 | C87: Ipswich | D87: =E87/F87 -> 0.17056798623063682 | E87: 991 | F87: 5810
A88: =RANK(D88,$D$5:$D$146) -> 84 | C88: Medford | D88: =E88/F88 -> 0.16478495804595175 | E88: 3751 | F88: 22763
A89: =RANK(D89,$D$5:$D$146) -> 85 | C89: Quincy | D89: =E89/F89 -> 0.16434285148220609 | E89: 6636 | F89: 40379
A90: =RANK(D90,$D$5:$D$146) -> 86 | C90: Gloucester | D90: =E90/F90 -> 0.16064313177210765 | E90: 2298 | F90: 14305
A91: =RANK(D91,$D$5:$D$146) -> 87 | C91: Revere | D91: =E91/F91 -> 0.1599666633983724 | E91: 3263 | F91: 20398
A92: =RANK(D92,$D$5:$D$146) -> 88 | C92: Malden | D92: =E92/F92 -> 0.15673428247448659 | E92: 3732 | F92: 23811
A93: =RANK(D93,$D$5:$D$146) -> 89 | C93: Plympton | D93: =E93/F93 -> 0.15594329334787349 | E93: 143 | F93: 917
A94: =RANK(D94,$D$5:$D$146) -> 90 | C94: West Newbury | D94: =E94/F94 -> 0.15405589638718473 | E94: 226 | F94: 1467
A95: =RANK(D95,$D$5:$D$146) -> 91 | C95: Milton | D95: =E95/F95 -> 0.15290454203801138 | E95: 1424 | F95: 9313
A96: =RANK(D96,$D$5:$D$146) -> 92 | C96: Scituate | D96: =E96/F96 -> 0.14426727410782081 | E96: 1140 | F96: 7902
A97: =RANK(D97,$D$5:$D$146) -> 93 | C97: North Andover | D97: =E97/F97 -> 0.14059463661095997 | E97: 1447 | F97: 10292
A98: =RANK(D98,$D$5:$D$146) -> 94 | C98: Topsfield | D98: =E98/F98 -> 0.1279926335174954 | E98: 278 | F98: 2172
A99: =RANK(D99,$D$5:$D$146) -> 95 | C99: Norwell | D99: =E99/F99 -> 0.12630098452883262 | E99: 449 | F99: 3555
A100: =RANK(D100,$D$5:$D$146) -> 96 | C100: Essex | D100: =E100/F100 -> 0.12617449664429531 | E100: 188 | F100: 1490
A101: =RANK(D101,$D$5:$D$146) -> 97 | C101: Andover | D101: =E101/F101 -> 0.1196029776674938 | E101: 1446 | F101: 12090
A102: =RANK(D102,$D$5:$D$146) -> 98 | C102: Wenham | D102: =E102/F102 -> 0.1184593023255814 | E102: 163 | F102: 1376
A103: =RANK(D103,$D$5:$D$146) -> 99 | C103: Everett | D103: =E103/F103 -> 0.1181852362451435 | E103: 1886 | F103: 15958
A104: =RANK(D104,$D$5:$D$146) -> 100 | C104: Lynnfield | D104: =E104/F104 -> 0.11067285382830626 | E104: 477 | F104: 4310
A105: =RANK(D105,$D$5:$D$146) -> 101 | C105: Hull | D105: =E105/F105 -> 0.1099381143065162 | E105: 604 | F105: 5494
A106: =RANK(D106,$D$5:$D$146) -> 102 | C106: Westwood | D106: =E106/F106 -> 0.10780460415496912 | E106: 576 | F106: 5343
A107: =RANK(D107,$D$5:$D$146) -> 103 | C107: Swampscott | D107: =E107/F107 -> 0.10450510802210684 | E107: 624 | F107: 5971
A108: =RANK(D108,$D$5:$D$146) -> 104 | C108: Nahant | D108: =E108/F108 -> 0.10296684118673648 | E108: 177 | F108: 1719
A109: =RANK(D109,$D$5:$D$146) -> 105 | C109: Berlin | D109: =E109/F109 -> 0.10028191703584374 | E109: 249 | F109: 2483
A110: =RANK(D110,$D$5:$D$146) -> 106 | C110: Arlington | D110: =E110/F110 -> 9.9764416675202292E-2 | E110: 1948 | F110: 19526
A111: =RANK(D111,$D$5:$D$146) -> 107 | C111: Salem | D111: =E111/F111 -> 9.8410087719298239E-2 | E111: 1795 | F111: 18240
A112: =RANK(D112,$D$5:$D$146) -> 108 | C112: Medfield | D112: =E112/F112 -> 9.438959788104985E-2 | E112: 392 | F112: 4153
A113: =RANK(D113,$D$5:$D$146) -> 109 | C113: Bedford | D113: =E113/F113 -> 9.2469761997658995E-2 | E113: 474 | F113: 5126
A114: =RANK(D114,$D$5:$D$146) -> 110 | C114: Lawrence | D114: =E114/F114 -> 9.093385214007782E-2 | E114: 2337 | F114: 25700
A115: =RANK(D115,$D$5:$D$146) -> 111 | C115: Lexington | D115: =E115/F115 -> 8.4442917275148188E-2 | E115: 983 | F115: 11641
A116: =RANK(D116,$D$5:$D$146) -> 112 | C116: Winchester | D116: =E116/F116 -> 8.1309924044328227E-2 | E116: 653 | F116: 8031
A117: =RANK(D117,$D$5:$D$146) -> 113 | C117: Acton | D117: =E117/F117 -> 8.0357142857142863E-2 | E117: 666 | F117: 8288
A118: =RANK(D118,$D$5:$D$146) -> 114 | C118: Wayland | D118: =E118/F118 -> 7.8121796186180023E-2 | E118: 381 | F118: 4877
A119: =RANK(D119,$D$5:$D$146) -> 115 | C119: Watertown | D119: =E119/F119 -> 7.7380952380952384E-2 | E119: 1170 | F119: 15120
A120: =RANK(D120,$D$5:$D$146) -> 116 | C120: Hingham | D120: =E120/F120 -> 7.6465260706430324E-2 | E120: 591 | F120: 7729
A121: =RANK(D121,$D$5:$D$146) -> 117 | C121: Needham | D121: =E121/F121 -> 7.5473399458972051E-2 | E121: 837 | F121: 11090
A122: =RANK(D122,$D$5:$D$146) -> 118 | C122: Winthrop | D122: =E122/F122 -> 7.333085593955159E-2 | E122: 592 | F122: 8073
A123: =RANK(D123,$D$5:$D$146) -> 119 | C123: Rockport | D123: =E123/F123 -> 7.1109018130445026E-2 | E123: 302 | F123: 4247
A124: =RANK(D124,$D$5:$D$146) -> 120 | C124: Duxbury | D124: =E124/F124 -> 6.8908791811369038E-2 | E124: 377 | F124: 5471
A125: =RANK(D125,$D$5:$D$146) -> 121 | C125: Southborough | D125: =E125/F125 -> 6.8553737284387434E-2 | E125: 620 | F125: 9044
A126: =RANK(D126,$D$5:$D$146) -> 122 | C126: Boxford | D126: =E126/F126 -> 5.8736608792020688E-2 | E126: 159 | F126: 2707
A127: =RANK(D127,$D$5:$D$146) -> 123 | C127: Sudbury | D127: =E127/F127 -> 5.4539237476491705E-2 | E127: 319 | F127: 5849
A128: =RANK(D128,$D$5:$D$146) -> 124 | C128: Cohasset | D128: =E128/F128 -> 5.2814454482279359E-2 | E128: 152 | F128: 2878
A129: =RANK(D129,$D$5:$D$146) -> 125 | C129: Bolton | D129: =E129/F129 -> 4.7872340425531915E-2 | E129: 207 | F129: 4324
A130: =RANK(D130,$D$5:$D$146) -> 126 | C130: Boxborough | D130: =E130/F130 -> 4.2532146389713157E-2 | E130: 86 | F130: 2022
A131: =RANK(D131,$D$5:$D$146) -> 127 | C131: Harvard | D131: =E131/F131 -> 4.0975447909754478E-2 | E131: 247 | F131: 6028
A132: =RANK(D132,$D$5:$D$146) -> 128 | C132: Marblehead | D132: =E132/F132 -> 3.7561301827909052E-2 | E132: 337 | F132: 8972
A133: =RANK(D133,$D$5:$D$146) -> 129 | C133: Chelsea | D133: =E133/F133 -> 3.5379644588045232E-2 | E133: 438 | F133: 12380
A134: =RANK(D134,$D$5:$D$146) -> 130 | C134: Concord | D134: =E134/F134 -> 3.482114593225704E-2 | E134: 220 | F134: 6318
A135: =RANK(D135,$D$5:$D$146) -> 131 | C135: Somerville | D135: =E135/F135 -> 2.6084568918176825E-2 | E135: 855 | F135: 32778
A136: =RANK(D136,$D$5:$D$146) -> 132 | C136: Weston | D136: =E136/F136 -> 2.3982013489882589E-2 | E136: 96 | F136: 4003
A137: =RANK(D137,$D$5:$D$146) -> 133 | C137: Newton | D137: =E137/F137 -> 1.8644016746483541E-2 | E137: 619 | F137: 33201
A138: =RANK(D138,$D$5:$D$146) -> 134 | C138: Wellesley | D138: =E138/F138 -> 1.8584070796460177E-2 | E138: 168 | F138: 9040
A139: =RANK(D139,$D$5:$D$146) -> 135 | C139: Carlisle | D139: =E139/F139 -> 1.6288539848749273E-2 | E139: 28 | F139: 1719
A140: =RANK(D140,$D$5:$D$146) -> 136 | C140: Dover | D140: =E140/F140 -> 1.5455950540958269E-2 | E140: 30 | F140: 1941
A141: =RANK(D141,$D$5:$D$146) -> 137 | C141: Belmont | D141: =E141/F141 -> 1.3977635782747603E-2 | E141: 140 | F141: 10016
A142: =RANK(D142,$D$5:$D$146) -> 138 | C142: Lincoln | D142: =E142/F142 -> 1.0854816824966078E-2 | E142: 32 | F142: 2948
A143: =RANK(D143,$D$5:$D$146) -> 139 | C143: Sherborn | D143: =E143/F143 -> 8.0160320641282558E-3 | E143: 12 | F143: 1497
A144: =RANK(D144,$D$5:$D$146) -> 140 | C144: Cambridge | D144: =E144/F144 -> 1.8921265276139172E-3 | E144: 85 | F144: 44923
A145: =RANK(D145,$D$5:$D$146) -> 141 | C145: Manchester | D145: =E145/F145 -> 1.6927634363097758E-3 | E145: 4 | F145: 2363
A146: =RANK(D146,$D$5:$D$146) -> 142 | C146: Brookline | D146: =E146/F146 -> 0 | E146: 0 | F146: 26447